{
  "schema_version": "yawr.run-results-digest-v1/v1",
  "algorithm": "sha256",
  "canonicalization": "yawr.run-results/v1 canonical JSON excluding digest",
  "generated_by": "independent Node.js standard-library script; expected literals are fixed",
  "cases": [
    {
      "name": "root-false",
      "semantic_record": {
        "outputs": {
          "result": {
            "value": false,
            "type": "bool"
          }
        },
        "origin": {
          "invocation": 1,
          "node_id": "results"
        },
        "checkpoint_sequence": 7,
        "plan_snapshot_digest": "sha256:1111111111111111111111111111111111111111111111111111111111111111",
        "publication_id": "root-false",
        "schema_version": "yawr.run-results/v1"
      },
      "source_utf8": "{\"outputs\":{\"result\":{\"value\":false,\"type\":\"bool\"}},\"origin\":{\"invocation\":1,\"node_id\":\"results\"},\"checkpoint_sequence\":7,\"plan_snapshot_digest\":\"sha256:1111111111111111111111111111111111111111111111111111111111111111\",\"publication_id\":\"root-false\",\"schema_version\":\"yawr.run-results/v1\"}",
      "source_base64": "eyJvdXRwdXRzIjp7InJlc3VsdCI6eyJ2YWx1ZSI6ZmFsc2UsInR5cGUiOiJib29sIn19LCJvcmlnaW4iOnsiaW52b2NhdGlvbiI6MSwibm9kZV9pZCI6InJlc3VsdHMifSwiY2hlY2twb2ludF9zZXF1ZW5jZSI6NywicGxhbl9zbmFwc2hvdF9kaWdlc3QiOiJzaGEyNTY6MTExMTExMTExMTExMTExMTExMTExMTExMTExMTExMTExMTExMTExMTExMTExMTExMTExMTExMTExMTExMTExMSIsInB1YmxpY2F0aW9uX2lkIjoicm9vdC1mYWxzZSIsInNjaGVtYV92ZXJzaW9uIjoieWF3ci5ydW4tcmVzdWx0cy92MSJ9",
      "canonical_utf8": "{\"checkpoint_sequence\":7,\"origin\":{\"invocation\":1,\"node_id\":\"results\"},\"outputs\":{\"result\":{\"type\":\"bool\",\"value\":false}},\"plan_snapshot_digest\":\"sha256:1111111111111111111111111111111111111111111111111111111111111111\",\"publication_id\":\"root-false\",\"schema_version\":\"yawr.run-results/v1\"}",
      "canonical_base64": "eyJjaGVja3BvaW50X3NlcXVlbmNlIjo3LCJvcmlnaW4iOnsiaW52b2NhdGlvbiI6MSwibm9kZV9pZCI6InJlc3VsdHMifSwib3V0cHV0cyI6eyJyZXN1bHQiOnsidHlwZSI6ImJvb2wiLCJ2YWx1ZSI6ZmFsc2V9fSwicGxhbl9zbmFwc2hvdF9kaWdlc3QiOiJzaGEyNTY6MTExMTExMTExMTExMTExMTExMTExMTExMTExMTExMTExMTExMTExMTExMTExMTExMTExMTExMTExMTExMTExMSIsInB1YmxpY2F0aW9uX2lkIjoicm9vdC1mYWxzZSIsInNjaGVtYV92ZXJzaW9uIjoieWF3ci5ydW4tcmVzdWx0cy92MSJ9",
      "sha256_hex": "bd002e527e437d5082b46ff6c3025097e079dc8a75e085e941b8cfb74cf3c4e9",
      "digest": "sha256:bd002e527e437d5082b46ff6c3025097e079dc8a75e085e941b8cfb74cf3c4e9",
      "canonical_with_digest_utf8": "{\"checkpoint_sequence\":7,\"digest\":\"sha256:bd002e527e437d5082b46ff6c3025097e079dc8a75e085e941b8cfb74cf3c4e9\",\"origin\":{\"invocation\":1,\"node_id\":\"results\"},\"outputs\":{\"result\":{\"type\":\"bool\",\"value\":false}},\"plan_snapshot_digest\":\"sha256:1111111111111111111111111111111111111111111111111111111111111111\",\"publication_id\":\"root-false\",\"schema_version\":\"yawr.run-results/v1\"}",
      "canonical_with_digest_base64": "eyJjaGVja3BvaW50X3NlcXVlbmNlIjo3LCJkaWdlc3QiOiJzaGEyNTY6YmQwMDJlNTI3ZTQzN2Q1MDgyYjQ2ZmY2YzMwMjUwOTdlMDc5ZGM4YTc1ZTA4NWU5NDFiOGNmYjc0Y2YzYzRlOSIsIm9yaWdpbiI6eyJpbnZvY2F0aW9uIjoxLCJub2RlX2lkIjoicmVzdWx0cyJ9LCJvdXRwdXRzIjp7InJlc3VsdCI6eyJ0eXBlIjoiYm9vbCIsInZhbHVlIjpmYWxzZX19LCJwbGFuX3NuYXBzaG90X2RpZ2VzdCI6InNoYTI1NjoxMTExMTExMTExMTExMTExMTExMTExMTExMTExMTExMTExMTExMTExMTExMTExMTExMTExMTExMTExMTExMTExIiwicHVibGljYXRpb25faWQiOiJyb290LWZhbHNlIiwic2NoZW1hX3ZlcnNpb24iOiJ5YXdyLnJ1bi1yZXN1bHRzL3YxIn0=",
      "metadata": {
        "description": "root scalar false",
        "source_order": "deliberate",
        "equivalence_group": "",
        "distinct_from": []
      }
    },
    {
      "name": "root-zero",
      "semantic_record": {
        "outputs": {
          "result": {
            "value": 0,
            "type": "integer"
          }
        },
        "origin": {
          "invocation": 1,
          "node_id": "results"
        },
        "checkpoint_sequence": 7,
        "plan_snapshot_digest": "sha256:1111111111111111111111111111111111111111111111111111111111111111",
        "publication_id": "root-zero",
        "schema_version": "yawr.run-results/v1"
      },
      "source_utf8": "{\"outputs\":{\"result\":{\"value\":0,\"type\":\"integer\"}},\"origin\":{\"invocation\":1,\"node_id\":\"results\"},\"checkpoint_sequence\":7,\"plan_snapshot_digest\":\"sha256:1111111111111111111111111111111111111111111111111111111111111111\",\"publication_id\":\"root-zero\",\"schema_version\":\"yawr.run-results/v1\"}",
      "source_base64": "eyJvdXRwdXRzIjp7InJlc3VsdCI6eyJ2YWx1ZSI6MCwidHlwZSI6ImludGVnZXIifX0sIm9yaWdpbiI6eyJpbnZvY2F0aW9uIjoxLCJub2RlX2lkIjoicmVzdWx0cyJ9LCJjaGVja3BvaW50X3NlcXVlbmNlIjo3LCJwbGFuX3NuYXBzaG90X2RpZ2VzdCI6InNoYTI1NjoxMTExMTExMTExMTExMTExMTExMTExMTExMTExMTExMTExMTExMTExMTExMTExMTExMTExMTExMTExMTExMTExIiwicHVibGljYXRpb25faWQiOiJyb290LXplcm8iLCJzY2hlbWFfdmVyc2lvbiI6Inlhd3IucnVuLXJlc3VsdHMvdjEifQ==",
      "canonical_utf8": "{\"checkpoint_sequence\":7,\"origin\":{\"invocation\":1,\"node_id\":\"results\"},\"outputs\":{\"result\":{\"type\":\"integer\",\"value\":0}},\"plan_snapshot_digest\":\"sha256:1111111111111111111111111111111111111111111111111111111111111111\",\"publication_id\":\"root-zero\",\"schema_version\":\"yawr.run-results/v1\"}",
      "canonical_base64": "eyJjaGVja3BvaW50X3NlcXVlbmNlIjo3LCJvcmlnaW4iOnsiaW52b2NhdGlvbiI6MSwibm9kZV9pZCI6InJlc3VsdHMifSwib3V0cHV0cyI6eyJyZXN1bHQiOnsidHlwZSI6ImludGVnZXIiLCJ2YWx1ZSI6MH19LCJwbGFuX3NuYXBzaG90X2RpZ2VzdCI6InNoYTI1NjoxMTExMTExMTExMTExMTExMTExMTExMTExMTExMTExMTExMTExMTExMTExMTExMTExMTExMTExMTExMTExMTExIiwicHVibGljYXRpb25faWQiOiJyb290LXplcm8iLCJzY2hlbWFfdmVyc2lvbiI6Inlhd3IucnVuLXJlc3VsdHMvdjEifQ==",
      "sha256_hex": "27a5e52e3b6fcdb62f4b07504a41017487003499dd9ff104e00144e335f469be",
      "digest": "sha256:27a5e52e3b6fcdb62f4b07504a41017487003499dd9ff104e00144e335f469be",
      "canonical_with_digest_utf8": "{\"checkpoint_sequence\":7,\"digest\":\"sha256:27a5e52e3b6fcdb62f4b07504a41017487003499dd9ff104e00144e335f469be\",\"origin\":{\"invocation\":1,\"node_id\":\"results\"},\"outputs\":{\"result\":{\"type\":\"integer\",\"value\":0}},\"plan_snapshot_digest\":\"sha256:1111111111111111111111111111111111111111111111111111111111111111\",\"publication_id\":\"root-zero\",\"schema_version\":\"yawr.run-results/v1\"}",
      "canonical_with_digest_base64": "eyJjaGVja3BvaW50X3NlcXVlbmNlIjo3LCJkaWdlc3QiOiJzaGEyNTY6MjdhNWU1MmUzYjZmY2RiNjJmNGIwNzUwNGE0MTAxNzQ4NzAwMzQ5OWRkOWZmMTA0ZTAwMTQ0ZTMzNWY0NjliZSIsIm9yaWdpbiI6eyJpbnZvY2F0aW9uIjoxLCJub2RlX2lkIjoicmVzdWx0cyJ9LCJvdXRwdXRzIjp7InJlc3VsdCI6eyJ0eXBlIjoiaW50ZWdlciIsInZhbHVlIjowfX0sInBsYW5fc25hcHNob3RfZGlnZXN0Ijoic2hhMjU2OjExMTExMTExMTExMTExMTExMTExMTExMTExMTExMTExMTExMTExMTExMTExMTExMTExMTExMTExMTExMTExMTEiLCJwdWJsaWNhdGlvbl9pZCI6InJvb3QtemVybyIsInNjaGVtYV92ZXJzaW9uIjoieWF3ci5ydW4tcmVzdWx0cy92MSJ9",
      "metadata": {
        "description": "root scalar zero",
        "source_order": "deliberate",
        "equivalence_group": "",
        "distinct_from": []
      }
    },
    {
      "name": "root-empty-string",
      "semantic_record": {
        "outputs": {
          "result": {
            "value": "",
            "type": "string"
          }
        },
        "origin": {
          "invocation": 1,
          "node_id": "results"
        },
        "checkpoint_sequence": 7,
        "plan_snapshot_digest": "sha256:1111111111111111111111111111111111111111111111111111111111111111",
        "publication_id": "root-empty-string",
        "schema_version": "yawr.run-results/v1"
      },
      "source_utf8": "{\"outputs\":{\"result\":{\"value\":\"\",\"type\":\"string\"}},\"origin\":{\"invocation\":1,\"node_id\":\"results\"},\"checkpoint_sequence\":7,\"plan_snapshot_digest\":\"sha256:1111111111111111111111111111111111111111111111111111111111111111\",\"publication_id\":\"root-empty-string\",\"schema_version\":\"yawr.run-results/v1\"}",
      "source_base64": "eyJvdXRwdXRzIjp7InJlc3VsdCI6eyJ2YWx1ZSI6IiIsInR5cGUiOiJzdHJpbmcifX0sIm9yaWdpbiI6eyJpbnZvY2F0aW9uIjoxLCJub2RlX2lkIjoicmVzdWx0cyJ9LCJjaGVja3BvaW50X3NlcXVlbmNlIjo3LCJwbGFuX3NuYXBzaG90X2RpZ2VzdCI6InNoYTI1NjoxMTExMTExMTExMTExMTExMTExMTExMTExMTExMTExMTExMTExMTExMTExMTExMTExMTExMTExMTExMTExMTExIiwicHVibGljYXRpb25faWQiOiJyb290LWVtcHR5LXN0cmluZyIsInNjaGVtYV92ZXJzaW9uIjoieWF3ci5ydW4tcmVzdWx0cy92MSJ9",
      "canonical_utf8": "{\"checkpoint_sequence\":7,\"origin\":{\"invocation\":1,\"node_id\":\"results\"},\"outputs\":{\"result\":{\"type\":\"string\",\"value\":\"\"}},\"plan_snapshot_digest\":\"sha256:1111111111111111111111111111111111111111111111111111111111111111\",\"publication_id\":\"root-empty-string\",\"schema_version\":\"yawr.run-results/v1\"}",
      "canonical_base64": "eyJjaGVja3BvaW50X3NlcXVlbmNlIjo3LCJvcmlnaW4iOnsiaW52b2NhdGlvbiI6MSwibm9kZV9pZCI6InJlc3VsdHMifSwib3V0cHV0cyI6eyJyZXN1bHQiOnsidHlwZSI6InN0cmluZyIsInZhbHVlIjoiIn19LCJwbGFuX3NuYXBzaG90X2RpZ2VzdCI6InNoYTI1NjoxMTExMTExMTExMTExMTExMTExMTExMTExMTExMTExMTExMTExMTExMTExMTExMTExMTExMTExMTExMTExMTExIiwicHVibGljYXRpb25faWQiOiJyb290LWVtcHR5LXN0cmluZyIsInNjaGVtYV92ZXJzaW9uIjoieWF3ci5ydW4tcmVzdWx0cy92MSJ9",
      "sha256_hex": "51756ada8cc27987a5b9178824aab158907e7b723db0d1b85793da8046a36710",
      "digest": "sha256:51756ada8cc27987a5b9178824aab158907e7b723db0d1b85793da8046a36710",
      "canonical_with_digest_utf8": "{\"checkpoint_sequence\":7,\"digest\":\"sha256:51756ada8cc27987a5b9178824aab158907e7b723db0d1b85793da8046a36710\",\"origin\":{\"invocation\":1,\"node_id\":\"results\"},\"outputs\":{\"result\":{\"type\":\"string\",\"value\":\"\"}},\"plan_snapshot_digest\":\"sha256:1111111111111111111111111111111111111111111111111111111111111111\",\"publication_id\":\"root-empty-string\",\"schema_version\":\"yawr.run-results/v1\"}",